{
  "$schema": "https://json-schema.org/draft/2020-12/schema",
  "$id": "rbk://schemas/canonical/lab.schema.json",
  "title": "RBK Lab (Canonical)",
  "type": "object",
  "additionalProperties": true,
  "required": ["lab_id", "title", "version", "visibility", "rubric", "created_at", "updated_at"],
  "properties": {
    "lab_id": { "type": "string", "pattern": "^[a-z0-9][a-z0-9_-]{1,63}$" },
    "title": { "type": "string", "minLength": 1, "maxLength": 200 },
    "version": { "type": "string", "pattern": "^\\d+\\.\\d+\\.\\d+$" },
    "description": { "type": "string" },
    "visibility": { "type": "string", "enum": ["public", "private"] },
    "rubric": { "type": "string", "minLength": 1, "maxLength": 128 },
    "tags": { "type": "array", "items": { "type": "string" } },
    "created_at": { "type": "string", "format": "date-time" },
    "updated_at": { "type": "string", "format": "date-time" }
  }
}
